{
    "$schema": "../../zplc.schema.json",
    "schemaVersion": 2,
    "name": "Analog Test",
    "version": "1.0.0",
    "description": "Raspberry Pi Pico: reads the internal temperature sensor (ADC channel 4, %IW8), converts it to degrees C in %QW4 and flags an implausible reading on %Q0.0. Analog input only: the Pico HAL has no DAC.",
    "target": {
        "board": "rpi_pico",
        "cpu": "rp2040",
        "clock_mhz": 125
    },
    "compiler": {
        "optimization": "none",
        "debug": true
    },
    "io": {
        "inputs": [],
        "outputs": [
            {
                "name": "SensorFault",
                "address": "%Q0.0",
                "type": "BOOL",
                "pin": 0,
                "description": "GP0 in the Pico overlay: ON while the reading is not a plausible temperature"
            }
        ],
        "virtual": [
            {
                "name": "TempC",
                "address": "%QW4",
                "type": "WORD",
                "description": "Temperature in whole degrees C. A word of the output image that no pin drives (the Pico has no DAC): watch it in the debugger"
            }
        ],
        "analog": {
            "adc": [
                {
                    "name": "TempRaw",
                    "address": "%IW8",
                    "channel": 4,
                    "bits": 12,
                    "description": "ADC channel 4 = RP2040 internal temperature sensor (the HAL maps channel n to %IW(4+n))"
                }
            ]
        }
    },
    "tasks": [
        {
            "name": "MainTask",
            "trigger": "cyclic",
            "interval_ms": 100,
            "priority": 1,
            "programs": [
                "main.st"
            ]
        }
    ],
    "build": {
        "outDir": "build"
    }
}
