{
  "$schema": "../../zplc.schema.json",
  "schemaVersion": 2,
  "name": "MultiTask Demo",
  "version": "1.0.0",
  "description": "Raspberry Pi Pico with two cyclic tasks: FastTask (10 ms) toggles LED1 on GP1 every 100 ms and SlowTask (100 ms) toggles LED2 on GP0 every 500 ms. Pins from firmware/app/boards/rpi_pico_rp2040.overlay. It has no scenario: the test engine runs one task per project, so check it on the board.",
  "author": "ZPLC Team",
  "target": {
    "board": "rpi_pico",
    "cpu": "rp2040",
    "clock_mhz": 125
  },
  "compiler": {
    "optimization": "none",
    "debug": true
  },
  "io": {
    "inputs": [],
    "outputs": [
      {
        "name": "LED1",
        "address": "%Q0.1",
        "description": "GP1 (led1 in the Pico overlay): fast blink, toggles every 100 ms",
        "pin": 1
      },
      {
        "name": "LED2",
        "address": "%Q0.0",
        "description": "GP0 (led0 in the Pico overlay): slow blink, toggles every 500 ms",
        "pin": 0
      }
    ]
  },
  "tasks": [
    {
      "name": "FastTask",
      "trigger": "cyclic",
      "interval_ms": 10,
      "priority": 0,
      "programs": ["FastBlink.st"]
    },
    {
      "name": "SlowTask",
      "trigger": "cyclic",
      "interval_ms": 100,
      "priority": 2,
      "programs": ["SlowBlink.st"]
    }
  ],
  "build": {
    "outDir": "build"
  }
}
