{
  "$schema": "../../zplc.schema.json",
  "schemaVersion": 2,
  "name": "Motor Control",
  "version": "1.0.0",
  "description": "Motor start/stop circuit with seal-in logic",
  "target": {
    "board": "posix"
  },
  "tasks": [
    {
      "name": "MainTask",
      "trigger": "cyclic",
      "interval_ms": 10,
      "priority": 1,
      "programs": ["main.ld"]
    }
  ],
  "build": {
    "outDir": "build"
  }
}
