{
  "schemaVersion": 2,
  "name": "sfc_pedestrian_crossing_starter",
  "version": "1.0.0",
  "target": {
    "board": "posix"
  },
  "tasks": [
    {
      "name": "MainTask",
      "trigger": "cyclic",
      "interval_ms": 10,
      "priority": 1,
      "programs": ["PedestrianCrossing.sfc"]
    }
  ]
}
